{
  "schema_version": "1.0.0",
  "loop_boundary_suggestion_id": "loopbounds_0123456789ABCDEFGHIJKLMN",
  "asset_id": "asset_01HZX8A7J2V3M4N5P6Q7R8S9T0",
  "version_id": "ver_01HZX8B7J2V3M4N5P6Q7R8S9T0",
  "generated_at": "2026-04-16T12:00:10Z",
  "detector": {
    "name": "default-analysis",
    "version": "0.1.2"
  },
  "suggestions": [
    {
      "start_seconds": 0,
      "end_seconds": 0.5,
      "duration_seconds": 0.5,
      "confidence": 0.88,
      "rationale": "Detected a 0.5s region that repeats in adjacent audio with 94% similarity and anchor support score 89%."
    }
  ]
}
